{
  "schema_version": "0.2",
  "event_id": "evt_synthetic_001",
  "occurred_at": "2026-10-16T12:00:00Z",
  "channel": "wechat",
  "account_id": "acct_synthetic_001",
  "room_id": "room_synthetic_001",
  "sender_id": "user_synthetic_001",
  "message_id": "msg_synthetic_001",
  "message_type": "text",
  "text": "@dot 请用一句话说明这个合成事件的测试目的。",
  "mention_bot": true,
  "from_self": false,
  "known_bot": false
}
